{
  "api_version": "llm.temporal/query/v1",
  "operation_key": "query-models",
  "query_execution_id": "qry-models",
  "kind": "model_inventory",
  "observed_at": "2026-07-18T03:14:15.926535Z",
  "source": "persisted",
  "freshness": "current",
  "complete": true,
  "result": {"models": []},
  "cost_status": "exact",
  "actual_cost_usd": "0",
  "cost_method": "control_query_zero"
}
